{
  "id": "artifact/hashing/bytes/all-byte-values",
  "title": "sha256 over all 256 byte values spans the padding boundary and stays binary-safe",
  "ports": [
    "hash"
  ],
  "capabilities": [],
  "steps": [
    {
      "op": "sha256Bytes",
      "args": [
        {
          "$b64": "AAECAwQFBgcICQoLDA0ODxAREhMUFRYXGBkaGxwdHh8gISIjJCUmJygpKissLS4vMDEyMzQ1Njc4OTo7PD0+P0BBQkNERUZHSElKS0xNTk9QUVJTVFVWV1hZWltcXV5fYGFiY2RlZmdoaWprbG1ub3BxcnN0dXZ3eHl6e3x9fn+AgYKDhIWGh4iJiouMjY6PkJGSk5SVlpeYmZqbnJ2en6ChoqOkpaanqKmqq6ytrq+wsbKztLW2t7i5uru8vb6/wMHCw8TFxsfIycrLzM3Oz9DR0tPU1dbX2Nna29zd3t/g4eLj5OXm5+jp6uvs7e7v8PHy8/T19vf4+fr7/P3+/w=="
        }
      ],
      "expect": {
        "value": {
          "algorithm": "sha256",
          "value": "40aff2e9d2d8922e47afd4648e6967497158785fbd1da870e7110266bf944880",
          "sizeBytes": 256
        }
      }
    }
  ]
}
