{
  "id": "artifact/hashing/canonical-json/surrogate-pair",
  "title": "an astral character is emitted as raw UTF-8, never as an ASCII escape",
  "ports": [
    "hash"
  ],
  "capabilities": [],
  "steps": [
    {
      "op": "canonicalJson",
      "args": [
        "😀"
      ],
      "expect": {
        "value": "\"😀\""
      }
    },
    {
      "op": "canonicalDigest",
      "args": [
        "😀"
      ],
      "expect": {
        "value": "7a0c50b92434b015545fe93ab723db2d4b2cdd14a441405624a9ce8be29f1d5a"
      }
    }
  ]
}
