{
  "id": "store/offset-without-limit-returns-the-tail",
  "title": "an offset with no limit returns every row after the offset",
  "ports": [
    "collection"
  ],
  "capabilities": [],
  "steps": [
    {
      "op": "put",
      "args": [
        "projects",
        {
          "id": "p1",
          "name": "alpha",
          "category": "ai",
          "priority": 1,
          "pinned": true
        }
      ]
    },
    {
      "op": "put",
      "args": [
        "projects",
        {
          "id": "p2",
          "name": "bravo",
          "category": "ai",
          "priority": 2,
          "pinned": false
        }
      ]
    },
    {
      "op": "put",
      "args": [
        "projects",
        {
          "id": "p3",
          "name": "charlie",
          "category": "web",
          "priority": 3,
          "pinned": true
        }
      ]
    },
    {
      "op": "put",
      "args": [
        "projects",
        {
          "id": "p4",
          "name": "delta",
          "category": "web",
          "priority": 4,
          "pinned": true
        }
      ]
    },
    {
      "op": "put",
      "args": [
        "projects",
        {
          "id": "p5",
          "name": "echo",
          "category": "ops",
          "priority": 5,
          "pinned": false
        }
      ]
    },
    {
      "op": "list",
      "args": [
        "projects",
        {
          "offset": 3
        }
      ],
      "expect": {
        "ids": [
          "p4",
          "p5"
        ]
      }
    }
  ]
}
